{
  "artifacts": {
    "authorization": "/Users/peter/Desktop/rtl-advisor/experiments/plugin-abc-v1/instrumented/phase7/arm-b/r2/replay-validation/items/g01/authorizations/authorization-f2fa0b8720a7a81f62b9.json",
    "capabilities": "/Users/peter/Desktop/rtl-advisor/experiments/plugin-abc-v1/instrumented/phase7/arm-b/r2/replay-validation/items/g01/capabilities/75750a34bad7eabd40d7fdc3d7839fbe696192bd9bf41041fc4509645633960e.json",
    "request": "/Users/peter/Desktop/rtl-advisor/experiments/plugin-abc-v1/instrumented/phase7/arm-b/r2/replay-validation/items/g01/request.json"
  },
  "authorization_semantic_hash": "06dffb9feb992b6dcec07e6bf6958439be6675653e5c18bca6154c3f413e5db1",
  "authorized_through": "measure",
  "capabilities_semantic_hash": "75750a34bad7eabd40d7fdc3d7839fbe696192bd9bf41041fc4509645633960e",
  "command": [
    "rtl-advisor",
    "--config",
    "/Users/peter/Desktop/rtl-advisor/rtl-advisor.toml",
    "agent",
    "workflow",
    "batch",
    "/Users/peter/Desktop/rtl-advisor/experiments/plugin-abc-v1/instrumented/phase7/arm-b/r2/attempt-001/batch-manifest.json",
    "--authorized-through",
    "measure",
    "--prompt-file",
    "/Users/peter/Desktop/rtl-advisor/experiments/plugin-abc-v1/instrumented/phase7/arm-b/r2/attempt-001/prompt.txt",
    "--output-dir",
    "/Users/peter/Desktop/rtl-advisor/experiments/plugin-abc-v1/instrumented/phase7/arm-b/r2/replay-validation",
    "--first-eligible",
    "--jobs",
    "1",
    "--schema-version",
    "1",
    "--json"
  ],
  "document_type": "rtl-advisor.workflow.preparation",
  "request_semantic_hash": "d14b14d54ef4621df7ab6ddd7333f7c167cdf9df673583c835c38b75b8180019",
  "schema": "rtl-advisor-workflow-preparation-v1",
  "schema_version": 1,
  "semantic_hash": "9e41075e9672e3ea63cddaa56c7b88db521e645d15696ab28e46e99d39e6af8e",
  "status": "prepared",
  "workflow_id": "workflow-6eb04148ae3e719a40a5"
}
