{
  "artifacts": {
    "authorization": "/Users/peter/Desktop/rtl-advisor/experiments/plugin-abc-v1/instrumented/phase7/arm-b/r1/attempt-001/items/o11/authorizations/authorization-5d96683a79f2f99ab0d0.json",
    "capabilities": "/Users/peter/Desktop/rtl-advisor/experiments/plugin-abc-v1/instrumented/phase7/arm-b/r1/attempt-001/items/o11/capabilities/75750a34bad7eabd40d7fdc3d7839fbe696192bd9bf41041fc4509645633960e.json",
    "request": "/Users/peter/Desktop/rtl-advisor/experiments/plugin-abc-v1/instrumented/phase7/arm-b/r1/attempt-001/items/o11/request.json"
  },
  "authorization_semantic_hash": "1e2632eb7d935e1eb1c96352f0aa271131eac0918c3ff9e88f0467eff0de1f61",
  "authorized_through": "measure",
  "capabilities_semantic_hash": "75750a34bad7eabd40d7fdc3d7839fbe696192bd9bf41041fc4509645633960e",
  "command": [
    "rtl-advisor",
    "--config",
    "/Users/peter/Desktop/rtl-advisor/rtl-advisor.toml",
    "agent",
    "workflow",
    "batch",
    "/Users/peter/Desktop/rtl-advisor/experiments/plugin-abc-v1/instrumented/phase7/arm-b/r1/attempt-001/batch-manifest.json",
    "--authorized-through",
    "measure",
    "--prompt-file",
    "/Users/peter/Desktop/rtl-advisor/experiments/plugin-abc-v1/instrumented/phase7/arm-b/r1/attempt-001/authorization-prompt.txt",
    "--output-dir",
    "/Users/peter/Desktop/rtl-advisor/experiments/plugin-abc-v1/instrumented/phase7/arm-b/r1/attempt-001",
    "--first-eligible",
    "--jobs",
    "1",
    "--schema-version",
    "1",
    "--json"
  ],
  "document_type": "rtl-advisor.workflow.preparation",
  "request_semantic_hash": "e116b164a0113054ff7d81e6aafe01f21ba1a80702044462875cc7d4f4a5476f",
  "schema": "rtl-advisor-workflow-preparation-v1",
  "schema_version": 1,
  "semantic_hash": "098d21bf441ca82ea1d102e39298e6680e61a2e8bc76e1fc92bac3f45720f2d6",
  "status": "prepared",
  "workflow_id": "workflow-3e5a03db24fd4ee459b1"
}
