{
  "artifacts": {
    "authorization": "/Users/peter/Desktop/rtl-advisor/experiments/plugin-abc-v1/instrumented/phase7/arm-b/r2/attempt-001/cli-output/items/g06/authorizations/authorization-a09e0701ab66740cecba.json",
    "capabilities": "/Users/peter/Desktop/rtl-advisor/experiments/plugin-abc-v1/instrumented/phase7/arm-b/r2/attempt-001/cli-output/items/g06/capabilities/75750a34bad7eabd40d7fdc3d7839fbe696192bd9bf41041fc4509645633960e.json",
    "request": "/Users/peter/Desktop/rtl-advisor/experiments/plugin-abc-v1/instrumented/phase7/arm-b/r2/attempt-001/cli-output/items/g06/request.json"
  },
  "authorization_semantic_hash": "a33bef565e3c7a9e77fb81c7581ff848f70ab6bb3d0163c31ef82c1f6cc87e2b",
  "authorized_through": "measure",
  "capabilities_semantic_hash": "75750a34bad7eabd40d7fdc3d7839fbe696192bd9bf41041fc4509645633960e",
  "command": [
    "rtl-advisor",
    "--config",
    "/Users/peter/Desktop/rtl-advisor/rtl-advisor.toml",
    "agent",
    "workflow",
    "batch",
    "/Users/peter/Desktop/rtl-advisor/experiments/plugin-abc-v1/instrumented/phase7/arm-b/r2/attempt-001/batch-manifest.json",
    "--authorized-through",
    "measure",
    "--prompt-file",
    "/Users/peter/Desktop/rtl-advisor/experiments/plugin-abc-v1/instrumented/phase7/arm-b/r2/attempt-001/prompt.txt",
    "--output-dir",
    "/Users/peter/Desktop/rtl-advisor/experiments/plugin-abc-v1/instrumented/phase7/arm-b/r2/attempt-001/cli-output",
    "--first-eligible",
    "--jobs",
    "1",
    "--schema-version",
    "1",
    "--json"
  ],
  "document_type": "rtl-advisor.workflow.preparation",
  "request_semantic_hash": "c94531dec7152032b30e0e5a06839b3860299094f4a04c5b6e30ea760475e0f4",
  "schema": "rtl-advisor-workflow-preparation-v1",
  "schema_version": 1,
  "semantic_hash": "b68a31c527c4d8c791464c73c758fa707a2a37e826bc66104f01b426c31d0102",
  "status": "prepared",
  "workflow_id": "workflow-83baa16b765a669d87a8"
}
