{
  "artifacts": {
    "authorization": "/Users/peter/Desktop/rtl-advisor/experiments/plugin-abc-v1/instrumented/phase7/arm-b/r2/attempt-002/workflow/items/g09/authorizations/authorization-ddbe40a21553e94fa34a.json",
    "capabilities": "/Users/peter/Desktop/rtl-advisor/experiments/plugin-abc-v1/instrumented/phase7/arm-b/r2/attempt-002/workflow/items/g09/capabilities/75750a34bad7eabd40d7fdc3d7839fbe696192bd9bf41041fc4509645633960e.json",
    "request": "/Users/peter/Desktop/rtl-advisor/experiments/plugin-abc-v1/instrumented/phase7/arm-b/r2/attempt-002/workflow/items/g09/request.json"
  },
  "authorization_semantic_hash": "af79f48e66312fd291302901016458adb48dcea4747b83485e5c5912f208bce4",
  "authorized_through": "measure",
  "capabilities_semantic_hash": "75750a34bad7eabd40d7fdc3d7839fbe696192bd9bf41041fc4509645633960e",
  "command": [
    "rtl-advisor",
    "--config",
    "/Users/peter/Desktop/rtl-advisor/rtl-advisor.toml",
    "agent",
    "workflow",
    "batch",
    "/Users/peter/Desktop/rtl-advisor/experiments/plugin-abc-v1/instrumented/phase7/arm-b/r2/attempt-002/batch-manifest.json",
    "--authorized-through",
    "measure",
    "--prompt-file",
    "/Users/peter/Desktop/rtl-advisor/experiments/plugin-abc-v1/instrumented/phase7/arm-b/r2/attempt-002/prompt.txt",
    "--output-dir",
    "/Users/peter/Desktop/rtl-advisor/experiments/plugin-abc-v1/instrumented/phase7/arm-b/r2/attempt-002/workflow",
    "--first-eligible",
    "--jobs",
    "1",
    "--schema-version",
    "1",
    "--json"
  ],
  "document_type": "rtl-advisor.workflow.preparation",
  "request_semantic_hash": "7b18982751ba2fa63712b12c29d2151a05d6311aa1720f19d0030c85d1e56295",
  "schema": "rtl-advisor-workflow-preparation-v1",
  "schema_version": 1,
  "semantic_hash": "b0763335d9c6658280968b0eb74a5bfa7715c547c3884a34de8a82f7b8af7fde",
  "status": "prepared",
  "workflow_id": "workflow-e823e46a6a9e34dc245e"
}
