{
  "artifacts": {
    "authorization": "/Users/peter/Desktop/rtl-advisor/experiments/plugin-abc-v1/instrumented/phase6/arm-b/r1/attempt-002/workflow-inputs/g06/authorizations/authorization-87b77a37d7bebb709250.json",
    "capabilities": "/Users/peter/Desktop/rtl-advisor/experiments/plugin-abc-v1/instrumented/phase6/arm-b/r1/attempt-002/workflow-inputs/g06/capabilities/9a4948bf1aae1a68b741aabeafe0d17b35a2e79d0d07db3fa096a09eb2ce6d91.json",
    "request": "/Users/peter/Desktop/rtl-advisor/experiments/plugin-abc-v1/instrumented/phase6/arm-b/r1/attempt-002/workflow-inputs/g06/request.json"
  },
  "authorization_semantic_hash": "570263fcd71103ef925731b2b733c905a2db95bd1c22cd70e50f25c423774af3",
  "authorized_through": "measure",
  "capabilities_semantic_hash": "9a4948bf1aae1a68b741aabeafe0d17b35a2e79d0d07db3fa096a09eb2ce6d91",
  "command": [
    "rtl-advisor",
    "--config",
    "/Users/peter/Desktop/rtl-advisor/experiments/plugin-abc-v1/instrumented/phase6/arm-b/r1/attempt-002/rtl-advisor.toml",
    "agent",
    "workflow",
    "prepare",
    "/Users/peter/Desktop/rtl-advisor/experiments/plugin-abc-v1/cases/generated/g06_priority_decode.sv",
    "--input-kind",
    "generated_rtl",
    "--objective",
    "balanced",
    "--authorized-through",
    "measure",
    "--top",
    "g06_priority_decode",
    "--prompt-file",
    "/Users/peter/Desktop/rtl-advisor/experiments/plugin-abc-v1/instrumented/phase6/arm-b/r1/attempt-002/authorization-prompt.txt",
    "--output-dir",
    "/Users/peter/Desktop/rtl-advisor/experiments/plugin-abc-v1/instrumented/phase6/arm-b/r1/attempt-002/workflow-inputs/g06",
    "--first-eligible",
    "--start",
    "--schema-version",
    "1",
    "--json"
  ],
  "document_type": "rtl-advisor.workflow.preparation",
  "request_semantic_hash": "c94531dec7152032b30e0e5a06839b3860299094f4a04c5b6e30ea760475e0f4",
  "schema": "rtl-advisor-workflow-preparation-v1",
  "schema_version": 1,
  "semantic_hash": "8376da89068913590acfa169383f97b882c62173e0d82ffb8430b6332eb219ba",
  "status": "prepared",
  "workflow_id": "workflow-83baa16b765a669d87a8"
}
