{
  "artifacts": {
    "authorization": "/Users/peter/Desktop/rtl-advisor/experiments/plugin-abc-v1/instrumented/phase7/arm-b/r2/attempt-001/cli-output/items/o12/authorizations/authorization-a5b5a43c60e1b4fc6f01.json",
    "capabilities": "/Users/peter/Desktop/rtl-advisor/experiments/plugin-abc-v1/instrumented/phase7/arm-b/r2/attempt-001/cli-output/items/o12/capabilities/75750a34bad7eabd40d7fdc3d7839fbe696192bd9bf41041fc4509645633960e.json",
    "request": "/Users/peter/Desktop/rtl-advisor/experiments/plugin-abc-v1/instrumented/phase7/arm-b/r2/attempt-001/cli-output/items/o12/request.json"
  },
  "authorization_semantic_hash": "7b844bcc75e5e1be2eeedfcb590c095fce2a74adaebb4474ca44083f9bea373c",
  "authorized_through": "measure",
  "capabilities_semantic_hash": "75750a34bad7eabd40d7fdc3d7839fbe696192bd9bf41041fc4509645633960e",
  "command": [
    "rtl-advisor",
    "--config",
    "/Users/peter/Desktop/rtl-advisor/rtl-advisor.toml",
    "agent",
    "workflow",
    "batch",
    "/Users/peter/Desktop/rtl-advisor/experiments/plugin-abc-v1/instrumented/phase7/arm-b/r2/attempt-001/batch-manifest.json",
    "--authorized-through",
    "measure",
    "--prompt-file",
    "/Users/peter/Desktop/rtl-advisor/experiments/plugin-abc-v1/instrumented/phase7/arm-b/r2/attempt-001/prompt.txt",
    "--output-dir",
    "/Users/peter/Desktop/rtl-advisor/experiments/plugin-abc-v1/instrumented/phase7/arm-b/r2/attempt-001/cli-output",
    "--first-eligible",
    "--jobs",
    "1",
    "--schema-version",
    "1",
    "--json"
  ],
  "document_type": "rtl-advisor.workflow.preparation",
  "request_semantic_hash": "0b0d6457adc967fe9b072f0c6636092b76f85927f9959ceb963f181b79fe3f1f",
  "schema": "rtl-advisor-workflow-preparation-v1",
  "schema_version": 1,
  "semantic_hash": "5656aff7f1a6404935dc39f63e2302b60405bbf29e464fc17678cceac61b5d07",
  "status": "prepared",
  "workflow_id": "workflow-97160b65942e60847789"
}
