{
  "artifacts": {
    "authorization": "/Users/peter/Desktop/rtl-advisor/experiments/plugin-abc-v1/instrumented/phase6/arm-b/r2/attempt-001/workflows/g05/authorizations/authorization-617c6144d04894047dff.json",
    "capabilities": "/Users/peter/Desktop/rtl-advisor/experiments/plugin-abc-v1/instrumented/phase6/arm-b/r2/attempt-001/workflows/g05/capabilities/08a9d75541db90d3bf6090f98c3e1cf7779b2f401cc3d5b61725b49ddc120857.json",
    "request": "/Users/peter/Desktop/rtl-advisor/experiments/plugin-abc-v1/instrumented/phase6/arm-b/r2/attempt-001/workflows/g05/request.json"
  },
  "authorization_semantic_hash": "e435c6de0869563a7a6b3fc7ffd65ab3f4738adcbf784da5b952081cd244e4c4",
  "authorized_through": "measure",
  "capabilities_semantic_hash": "08a9d75541db90d3bf6090f98c3e1cf7779b2f401cc3d5b61725b49ddc120857",
  "command": [
    "rtl-advisor",
    "--config",
    "/Users/peter/Desktop/rtl-advisor/experiments/plugin-abc-v1/instrumented/phase6/arm-b/r2/attempt-001/rtl-advisor.toml",
    "agent",
    "workflow",
    "prepare",
    "/Users/peter/Desktop/rtl-advisor/experiments/plugin-abc-v1/cases/generated/g05_mux_common_logic.sv",
    "--input-kind",
    "generated_rtl",
    "--objective",
    "balanced",
    "--authorized-through",
    "measure",
    "--top",
    "g05_mux_common_logic",
    "--prompt-file",
    "/Users/peter/Desktop/rtl-advisor/experiments/plugin-abc-v1/instrumented/phase6/arm-b/r2/attempt-001/user-prompt.txt",
    "--output-dir",
    "/Users/peter/Desktop/rtl-advisor/experiments/plugin-abc-v1/instrumented/phase6/arm-b/r2/attempt-001/workflows/g05",
    "--first-eligible",
    "--start",
    "--schema-version",
    "1",
    "--json"
  ],
  "document_type": "rtl-advisor.workflow.preparation",
  "request_semantic_hash": "dbb4f32fb4ee80ca6d32b6a29d042d2744e5a681d29330ec5bd3e35365d5fa25",
  "schema": "rtl-advisor-workflow-preparation-v1",
  "schema_version": 1,
  "semantic_hash": "abb6642f41558be69d21e8724a34530bbd99705089204a700ddf7ac23237c359",
  "status": "prepared",
  "workflow_id": "workflow-016afd9b69d6512c99c5"
}
