{
  "artifacts": {
    "authorization": "/Users/peter/Desktop/rtl-advisor/experiments/plugin-abc-v1/instrumented/phase6/arm-b/r2/attempt-001/workflows/g06/authorizations/authorization-f0f1cba76cc7bd8e784f.json",
    "capabilities": "/Users/peter/Desktop/rtl-advisor/experiments/plugin-abc-v1/instrumented/phase6/arm-b/r2/attempt-001/workflows/g06/capabilities/08a9d75541db90d3bf6090f98c3e1cf7779b2f401cc3d5b61725b49ddc120857.json",
    "request": "/Users/peter/Desktop/rtl-advisor/experiments/plugin-abc-v1/instrumented/phase6/arm-b/r2/attempt-001/workflows/g06/request.json"
  },
  "authorization_semantic_hash": "5a97ea70876f64b7b7a73a328d4df49809cf9fa33ea42dfec8008be017afbfb8",
  "authorized_through": "measure",
  "capabilities_semantic_hash": "08a9d75541db90d3bf6090f98c3e1cf7779b2f401cc3d5b61725b49ddc120857",
  "command": [
    "rtl-advisor",
    "--config",
    "/Users/peter/Desktop/rtl-advisor/experiments/plugin-abc-v1/instrumented/phase6/arm-b/r2/attempt-001/rtl-advisor.toml",
    "agent",
    "workflow",
    "prepare",
    "/Users/peter/Desktop/rtl-advisor/experiments/plugin-abc-v1/cases/generated/g06_priority_decode.sv",
    "--input-kind",
    "generated_rtl",
    "--objective",
    "balanced",
    "--authorized-through",
    "measure",
    "--top",
    "g06_priority_decode",
    "--prompt-file",
    "/Users/peter/Desktop/rtl-advisor/experiments/plugin-abc-v1/instrumented/phase6/arm-b/r2/attempt-001/user-prompt.txt",
    "--output-dir",
    "/Users/peter/Desktop/rtl-advisor/experiments/plugin-abc-v1/instrumented/phase6/arm-b/r2/attempt-001/workflows/g06",
    "--first-eligible",
    "--start",
    "--schema-version",
    "1",
    "--json"
  ],
  "document_type": "rtl-advisor.workflow.preparation",
  "request_semantic_hash": "c94531dec7152032b30e0e5a06839b3860299094f4a04c5b6e30ea760475e0f4",
  "schema": "rtl-advisor-workflow-preparation-v1",
  "schema_version": 1,
  "semantic_hash": "225c0d85baf27d426e542d2080cfa1104743a85d922a8c6162ca52c3f0411b9d",
  "status": "prepared",
  "workflow_id": "workflow-83baa16b765a669d87a8"
}
