{
  "artifacts": {
    "authorization": "/Users/peter/Desktop/rtl-advisor/experiments/plugin-abc-v1/instrumented/phase6/arm-b/r1/attempt-002/workflow-inputs/g08/authorizations/authorization-d536bb072926faa723e7.json",
    "capabilities": "/Users/peter/Desktop/rtl-advisor/experiments/plugin-abc-v1/instrumented/phase6/arm-b/r1/attempt-002/workflow-inputs/g08/capabilities/9a4948bf1aae1a68b741aabeafe0d17b35a2e79d0d07db3fa096a09eb2ce6d91.json",
    "request": "/Users/peter/Desktop/rtl-advisor/experiments/plugin-abc-v1/instrumented/phase6/arm-b/r1/attempt-002/workflow-inputs/g08/request.json"
  },
  "authorization_semantic_hash": "c9eb5495c7ea0fc3ac03db23d5c1f3bddea0849792b4d3fa77ec2db03efe1e75",
  "authorized_through": "measure",
  "capabilities_semantic_hash": "9a4948bf1aae1a68b741aabeafe0d17b35a2e79d0d07db3fa096a09eb2ce6d91",
  "command": [
    "rtl-advisor",
    "--config",
    "/Users/peter/Desktop/rtl-advisor/experiments/plugin-abc-v1/instrumented/phase6/arm-b/r1/attempt-002/rtl-advisor.toml",
    "agent",
    "workflow",
    "prepare",
    "/Users/peter/Desktop/rtl-advisor/experiments/plugin-abc-v1/cases/generated/g08_signed_chain.sv",
    "--input-kind",
    "generated_rtl",
    "--objective",
    "balanced",
    "--authorized-through",
    "measure",
    "--top",
    "g08_signed_chain",
    "--prompt-file",
    "/Users/peter/Desktop/rtl-advisor/experiments/plugin-abc-v1/instrumented/phase6/arm-b/r1/attempt-002/authorization-prompt.txt",
    "--output-dir",
    "/Users/peter/Desktop/rtl-advisor/experiments/plugin-abc-v1/instrumented/phase6/arm-b/r1/attempt-002/workflow-inputs/g08",
    "--first-eligible",
    "--start",
    "--schema-version",
    "1",
    "--json"
  ],
  "document_type": "rtl-advisor.workflow.preparation",
  "request_semantic_hash": "1fbac3867c4f6df9f8718dd4269b4a1f1d80ebcbb2008a4d24674f3a5f472d96",
  "schema": "rtl-advisor-workflow-preparation-v1",
  "schema_version": 1,
  "semantic_hash": "f093e4264756d5eb6a58f7083d35bd5725bf70e6111a0e42ccd36d2a6a0d646a",
  "status": "prepared",
  "workflow_id": "workflow-a00a174912f1484f3dc5"
}
