{
  "artifacts": {
    "authorization": "/Users/peter/Desktop/rtl-advisor/experiments/plugin-abc-v1/instrumented/phase6/arm-b/r1/attempt-002/workflow-inputs/o12-raw/authorizations/authorization-9831f6c4c3e0bd80f8ff.json",
    "capabilities": "/Users/peter/Desktop/rtl-advisor/experiments/plugin-abc-v1/instrumented/phase6/arm-b/r1/attempt-002/workflow-inputs/o12-raw/capabilities/9a4948bf1aae1a68b741aabeafe0d17b35a2e79d0d07db3fa096a09eb2ce6d91.json",
    "request": "/Users/peter/Desktop/rtl-advisor/experiments/plugin-abc-v1/instrumented/phase6/arm-b/r1/attempt-002/workflow-inputs/o12-raw/request.json"
  },
  "authorization_semantic_hash": "2100d086b12444f77691ac8cc8c4d6d47dd9a44c07c9796c13f35726acb6e2b6",
  "authorized_through": "measure",
  "capabilities_semantic_hash": "9a4948bf1aae1a68b741aabeafe0d17b35a2e79d0d07db3fa096a09eb2ce6d91",
  "command": [
    "rtl-advisor",
    "--config",
    "/Users/peter/Desktop/rtl-advisor/experiments/plugin-abc-v1/instrumented/phase6/arm-b/r1/attempt-002/rtl-advisor.toml",
    "agent",
    "workflow",
    "prepare",
    "/Users/peter/Desktop/rtl-advisor/corpus/upstream/verilog-axis/rtl/axis_pipeline_fifo.v",
    "--input-kind",
    "explicitly_approved_open_rtl",
    "--objective",
    "balanced",
    "--authorized-through",
    "measure",
    "--top",
    "axis_pipeline_fifo",
    "--prompt-file",
    "/Users/peter/Desktop/rtl-advisor/experiments/plugin-abc-v1/instrumented/phase6/arm-b/r1/attempt-002/authorization-prompt.txt",
    "--output-dir",
    "/Users/peter/Desktop/rtl-advisor/experiments/plugin-abc-v1/instrumented/phase6/arm-b/r1/attempt-002/workflow-inputs/o12-raw",
    "--first-eligible",
    "--start",
    "--schema-version",
    "1",
    "--json"
  ],
  "document_type": "rtl-advisor.workflow.preparation",
  "request_semantic_hash": "0b0d6457adc967fe9b072f0c6636092b76f85927f9959ceb963f181b79fe3f1f",
  "schema": "rtl-advisor-workflow-preparation-v1",
  "schema_version": 1,
  "semantic_hash": "63bb2ffd76e7f0f5f3becb059c442794684efe1dc8ac2c2c2da450cb11bce436",
  "status": "prepared",
  "workflow_id": "workflow-97160b65942e60847789"
}
