{
  "artifacts": {
    "authorization": "/Users/peter/Desktop/rtl-advisor/experiments/plugin-abc-v1/instrumented/phase6/arm-b/r1/attempt-002/workflow-inputs/o10-raw/authorizations/authorization-02bc591f7b4276625b15.json",
    "capabilities": "/Users/peter/Desktop/rtl-advisor/experiments/plugin-abc-v1/instrumented/phase6/arm-b/r1/attempt-002/workflow-inputs/o10-raw/capabilities/9a4948bf1aae1a68b741aabeafe0d17b35a2e79d0d07db3fa096a09eb2ce6d91.json",
    "request": "/Users/peter/Desktop/rtl-advisor/experiments/plugin-abc-v1/instrumented/phase6/arm-b/r1/attempt-002/workflow-inputs/o10-raw/request.json"
  },
  "authorization_semantic_hash": "be2f8de5f31aa5a94ee129ea88c4d0f148aeb9483e5f32996c70f9133a6f4a48",
  "authorized_through": "measure",
  "capabilities_semantic_hash": "9a4948bf1aae1a68b741aabeafe0d17b35a2e79d0d07db3fa096a09eb2ce6d91",
  "command": [
    "rtl-advisor",
    "--config",
    "/Users/peter/Desktop/rtl-advisor/experiments/plugin-abc-v1/instrumented/phase6/arm-b/r1/attempt-002/rtl-advisor.toml",
    "agent",
    "workflow",
    "prepare",
    "/Users/peter/Desktop/rtl-advisor/corpus/upstream/verilog-axis/rtl/axis_register.v",
    "--input-kind",
    "explicitly_approved_open_rtl",
    "--objective",
    "balanced",
    "--authorized-through",
    "measure",
    "--top",
    "axis_register",
    "--prompt-file",
    "/Users/peter/Desktop/rtl-advisor/experiments/plugin-abc-v1/instrumented/phase6/arm-b/r1/attempt-002/authorization-prompt.txt",
    "--output-dir",
    "/Users/peter/Desktop/rtl-advisor/experiments/plugin-abc-v1/instrumented/phase6/arm-b/r1/attempt-002/workflow-inputs/o10-raw",
    "--first-eligible",
    "--start",
    "--schema-version",
    "1",
    "--json"
  ],
  "document_type": "rtl-advisor.workflow.preparation",
  "request_semantic_hash": "827b56c12b9749a493adc848dfd216aac83d88e50b939fc36c382028b3f62cff",
  "schema": "rtl-advisor-workflow-preparation-v1",
  "schema_version": 1,
  "semantic_hash": "e171c2cd5c8f22fb6e6320ffba8690954e016c2e745069c51cb2688a99f4f0c2",
  "status": "prepared",
  "workflow_id": "workflow-052e0191157d5925e13f"
}
