{
  "artifacts": {
    "authorization": "/Users/peter/Desktop/rtl-advisor/experiments/plugin-abc-v1/instrumented/phase6/arm-b/r1/attempt-002/workflow-inputs/g07/authorizations/authorization-0b2e8016d4f869865e53.json",
    "capabilities": "/Users/peter/Desktop/rtl-advisor/experiments/plugin-abc-v1/instrumented/phase6/arm-b/r1/attempt-002/workflow-inputs/g07/capabilities/9a4948bf1aae1a68b741aabeafe0d17b35a2e79d0d07db3fa096a09eb2ce6d91.json",
    "request": "/Users/peter/Desktop/rtl-advisor/experiments/plugin-abc-v1/instrumented/phase6/arm-b/r1/attempt-002/workflow-inputs/g07/request.json"
  },
  "authorization_semantic_hash": "2ffa6d769247afc665d71c85e7abe18ce7686f35748bac43e3a55fdc5b835bd1",
  "authorized_through": "measure",
  "capabilities_semantic_hash": "9a4948bf1aae1a68b741aabeafe0d17b35a2e79d0d07db3fa096a09eb2ce6d91",
  "command": [
    "rtl-advisor",
    "--config",
    "/Users/peter/Desktop/rtl-advisor/experiments/plugin-abc-v1/instrumented/phase6/arm-b/r1/attempt-002/rtl-advisor.toml",
    "agent",
    "workflow",
    "prepare",
    "/Users/peter/Desktop/rtl-advisor/experiments/plugin-abc-v1/cases/generated/g07_width_truncation.sv",
    "--input-kind",
    "generated_rtl",
    "--objective",
    "balanced",
    "--authorized-through",
    "measure",
    "--top",
    "g07_width_truncation",
    "--prompt-file",
    "/Users/peter/Desktop/rtl-advisor/experiments/plugin-abc-v1/instrumented/phase6/arm-b/r1/attempt-002/authorization-prompt.txt",
    "--output-dir",
    "/Users/peter/Desktop/rtl-advisor/experiments/plugin-abc-v1/instrumented/phase6/arm-b/r1/attempt-002/workflow-inputs/g07",
    "--first-eligible",
    "--start",
    "--schema-version",
    "1",
    "--json"
  ],
  "document_type": "rtl-advisor.workflow.preparation",
  "request_semantic_hash": "37b5b4c3510c754735c8dbe3fd4c93b91a29c6fc7d5303091e3f66ac7ba7299d",
  "schema": "rtl-advisor-workflow-preparation-v1",
  "schema_version": 1,
  "semantic_hash": "e4c13bb345de3e356c5fe6efab7ddcffbd78370dea5d825671f2f115800f178e",
  "status": "prepared",
  "workflow_id": "workflow-a4cbc92845fb7f1d143c"
}
